{
  "$schema": "../schema/section.schema.json",
  "name": "ecommerce-hero",
  "type": "registry:section",
  "domain": "ecommerce",
  "registryDependencies": [],
  "dependencies": [
    "motion",
    "lucide-react"
  ],
  "devDependencies": [],
  "shadcnDependencies": [
    "button"
  ],
  "projectDependencies": [
    {
      "name": "Heading",
      "path": "components/Heading.tsx",
      "required": true
    },
    {
      "name": "Paragraph",
      "path": "components/Paragraph.tsx",
      "required": true
    },
    {
      "name": "Container",
      "path": "components/Container.tsx",
      "required": true
    }
  ],
  "fonts": [
    {
      "name": "CalSans",
      "path": "fonts/CalSans-SemiBold.woff2",
      "required": true
    }
  ],
  "files": [
    {
      "name": "ecommerce-hero.tsx",
      "content": "import React from 'react';\nimport { motion } from 'motion/react';\nimport { Button } from '@/components/ui/button';\nimport { Heading } from '@/components/Heading';\nimport { Paragraph } from '@/components/Paragraph';\nimport { Container } from '@/components/Container';\nimport { ArrowRight } from 'lucide-react';\nimport Image from 'next/image';\n\ninterface EcommerceHeroProps {\n  title: string;\n  subtitle?: string;\n  ctaText?: string;\n  ctaLink: string;\n  imageSrc: string;\n  imageAlt?: string;\n}\n\nexport function EcommerceHero({\n  title,\n  subtitle,\n  ctaText = 'Shop Now',\n  ctaLink,\n  imageSrc,\n  imageAlt = 'Hero image'\n}: EcommerceHeroProps) {\n  return (\n    <section className=\"relative h-dvh bg-background\">\n      <Container>\n        <div className=\"flex flex-col lg:flex-row items-center justify-between min-h-dvh py-20 gap-12\">\n          <motion.div\n            initial={{ opacity: 0, y: 20 }}\n            animate={{ opacity: 1, y: 0 }}\n            transition={{ duration: 0.5, ease: 'easeOut' }}\n            className=\"flex-1 space-y-6 text-center lg:text-left\"\n          >\n            <Heading className=\"text-balance\">{title}</Heading>\n            {subtitle && (\n              <Paragraph className=\"text-pretty max-w-2xl\">\n                {subtitle}\n              </Paragraph>\n            )}\n            <div>\n              <Button size=\"lg\" asChild>\n                <a href={ctaLink}>\n                  {ctaText}\n                  <ArrowRight className=\"ml-2 size-4\" aria-hidden=\"true\" />\n                </a>\n              </Button>\n            </div>\n          </motion.div>\n          \n          <motion.div\n            initial={{ opacity: 0, scale: 0.95 }}\n            animate={{ opacity: 1, scale: 1 }}\n            transition={{ duration: 0.5, ease: 'easeOut', delay: 0.1 }}\n            className=\"flex-1 relative w-full max-w-lg aspect-square\"\n          >\n            <Image\n              src={imageSrc}\n              alt={imageAlt}\n              fill\n              className=\"object-contain dark:opacity-90\"\n              priority\n            />\n          </motion.div>\n        </div>\n      </Container>\n    </section>\n  );\n}\n"
    }
  ],
  "meta": {
    "label": "E-Commerce Hero",
    "description": "Full-width hero section for e-commerce landing pages with image showcase",
    "tags": ["hero", "landing", "ecommerce", "cta", "featured"],
    "category": "hero",
    "tier": "free",
    "complexity": "simple",
    "responsive": true,
    "darkMode": true,
    "animations": "Entrance fade with motion/react (ease-out, 500ms)",
    "uiSkillsCompliant": true
  }
}
