{
  "$schema": "../schema/section.schema.json",
  "name": "portfolio-hero",
  "type": "registry:section",
  "domain": "portfolio",
  "registryDependencies": [],
  "dependencies": [
    "motion",
    "lucide-react"
  ],
  "devDependencies": [],
  "shadcnDependencies": [
    "button",
    "badge"
  ],
  "projectDependencies": [
    {
      "name": "Heading",
      "path": "components/Heading.tsx",
      "required": true
    },
    {
      "name": "Paragraph",
      "path": "components/Paragraph.tsx",
      "required": true
    },
    {
      "name": "Container",
      "path": "components/Container.tsx",
      "required": true
    }
  ],
  "fonts": [
    {
      "name": "CalSans",
      "path": "fonts/CalSans-SemiBold.woff2",
      "required": true
    }
  ],
  "files": [
    {
      "name": "portfolio-hero.tsx",
      "content": "import React from 'react';\nimport { motion } from 'motion/react';\nimport { Button } from '@/components/ui/button';\nimport { Badge } from '@/components/ui/badge';\nimport { Heading } from '@/components/Heading';\nimport { Paragraph } from '@/components/Paragraph';\nimport { Container } from '@/components/Container';\nimport { ArrowRight, Github, Linkedin, Mail } from 'lucide-react';\nimport Image from 'next/image';\n\ninterface PortfolioHeroProps {\n  name: string;\n  tagline: string;\n  description: string;\n  avatarSrc: string;\n  skills: string[];\n  ctaText?: string;\n  ctaLink: string;\n  socialLinks?: {\n    github?: string;\n    linkedin?: string;\n    email?: string;\n  };\n}\n\nexport function PortfolioHero({\n  name,\n  tagline,\n  description,\n  avatarSrc,\n  skills,\n  ctaText = 'View Projects',\n  ctaLink,\n  socialLinks\n}: PortfolioHeroProps) {\n  return (\n    <section className=\"relative min-h-dvh flex items-center py-20 bg-background\">\n      <Container>\n        <div className=\"flex flex-col lg:flex-row items-center gap-12\">\n          <motion.div\n            initial={{ opacity: 0, scale: 0.95 }}\n            animate={{ opacity: 1, scale: 1 }}\n            transition={{ duration: 0.5, ease: 'easeOut' }}\n            className=\"relative size-64 lg:size-80 shrink-0\"\n          >\n            <div className=\"relative size-full rounded-full overflow-hidden border-4 border-border\">\n              <Image\n                src={avatarSrc}\n                alt={name}\n                fill\n                className=\"object-cover\"\n                priority\n              />\n            </div>\n          </motion.div>\n          \n          <motion.div\n            initial={{ opacity: 0, y: 20 }}\n            animate={{ opacity: 1, y: 0 }}\n            transition={{ duration: 0.5, ease: 'easeOut', delay: 0.1 }}\n            className=\"flex-1 space-y-6 text-center lg:text-left\"\n          >\n            <div className=\"space-y-4\">\n              <Heading className=\"text-balance\">{name}</Heading>\n              <p className=\"text-xl text-muted-foreground\">{tagline}</p>\n              <Paragraph className=\"text-pretty max-w-2xl\">\n                {description}\n              </Paragraph>\n            </div>\n            \n            <div className=\"flex flex-wrap gap-2 justify-center lg:justify-start\">\n              {skills.map((skill, index) => (\n                <Badge key={index} variant=\"secondary\">\n                  {skill}\n                </Badge>\n              ))}\n            </div>\n            \n            <div className=\"flex flex-wrap gap-4 justify-center lg:justify-start\">\n              <Button size=\"lg\" asChild>\n                <a href={ctaLink}>\n                  {ctaText}\n                  <ArrowRight className=\"ml-2 size-4\" aria-hidden=\"true\" />\n                </a>\n              </Button>\n              \n              {socialLinks && (\n                <div className=\"flex gap-2\">\n                  {socialLinks.github && (\n                    <Button size=\"lg\" variant=\"outline\" asChild>\n                      <a href={socialLinks.github} aria-label=\"GitHub Profile\">\n                        <Github className=\"size-5\" />\n                      </a>\n                    </Button>\n                  )}\n                  {socialLinks.linkedin && (\n                    <Button size=\"lg\" variant=\"outline\" asChild>\n                      <a href={socialLinks.linkedin} aria-label=\"LinkedIn Profile\">\n                        <Linkedin className=\"size-5\" />\n                      </a>\n                    </Button>\n                  )}\n                  {socialLinks.email && (\n                    <Button size=\"lg\" variant=\"outline\" asChild>\n                      <a href={`mailto:${socialLinks.email}`} aria-label=\"Email Contact\">\n                        <Mail className=\"size-5\" />\n                      </a>\n                    </Button>\n                  )}\n                </div>\n              )}\n            </div>\n          </motion.div>\n        </div>\n      </Container>\n    </section>\n  );\n}\n"
    }
  ],
  "meta": {
    "label": "Portfolio Hero",
    "description": "Personal portfolio hero with avatar, bio, skills, and social links",
    "tags": ["hero", "portfolio", "personal", "about", "introduction"],
    "category": "hero",
    "tier": "free",
    "complexity": "simple",
    "responsive": true,
    "darkMode": true,
    "animations": "Entrance fade with motion/react (ease-out, 500ms)",
    "uiSkillsCompliant": true
  }
}
