{
  "$schema": "../schema/section.schema.json",
  "name": "restaurant-menu",
  "type": "registry:section",
  "domain": "restaurant",
  "registryDependencies": [],
  "dependencies": [
    "lucide-react"
  ],
  "devDependencies": [],
  "shadcnDependencies": [
    "card",
    "badge",
    "separator"
  ],
  "projectDependencies": [
    {
      "name": "Heading",
      "path": "components/Heading.tsx",
      "required": true
    },
    {
      "name": "Paragraph",
      "path": "components/Paragraph.tsx",
      "required": true
    },
    {
      "name": "Container",
      "path": "components/Container.tsx",
      "required": true
    }
  ],
  "fonts": [
    {
      "name": "CalSans",
      "path": "fonts/CalSans-SemiBold.woff2",
      "required": true
    }
  ],
  "files": [
    {
      "name": "restaurant-menu.tsx",
      "content": "import React from 'react';\nimport { Card, CardContent, CardDescription, CardHeader, CardTitle } from '@/components/ui/card';\nimport { Badge } from '@/components/ui/badge';\nimport { Separator } from '@/components/ui/separator';\nimport { Heading } from '@/components/Heading';\nimport { Paragraph } from '@/components/Paragraph';\nimport { Container } from '@/components/Container';\nimport { Leaf, Flame } from 'lucide-react';\nimport Image from 'next/image';\n\ninterface MenuItem {\n  name: string;\n  description: string;\n  price: string;\n  image?: string;\n  vegetarian?: boolean;\n  spicy?: boolean;\n  popular?: boolean;\n}\n\ninterface MenuCategory {\n  category: string;\n  description?: string;\n  items: MenuItem[];\n}\n\ninterface RestaurantMenuProps {\n  title: string;\n  subtitle?: string;\n  categories: MenuCategory[];\n}\n\nexport function RestaurantMenu({ title, subtitle, categories }: RestaurantMenuProps) {\n  return (\n    <section className=\"py-20 bg-background\">\n      <Container>\n        <div className=\"space-y-12\">\n          <div className=\"text-center space-y-4\">\n            <Heading className=\"text-balance\">{title}</Heading>\n            {subtitle && (\n              <Paragraph className=\"text-pretty max-w-2xl mx-auto text-muted-foreground\">\n                {subtitle}\n              </Paragraph>\n            )}\n          </div>\n          \n          <div className=\"space-y-16\">\n            {categories.map((category, catIndex) => (\n              <div key={catIndex} className=\"space-y-6\">\n                <div className=\"space-y-2\">\n                  <h3 className=\"text-2xl font-bold text-foreground\">{category.category}</h3>\n                  {category.description && (\n                    <p className=\"text-muted-foreground\">{category.description}</p>\n                  )}\n                  <Separator />\n                </div>\n                \n                <div className=\"grid md:grid-cols-2 gap-6\">\n                  {category.items.map((item, itemIndex) => (\n                    <Card key={itemIndex}>\n                      <CardHeader>\n                        <div className=\"flex items-start justify-between gap-4\">\n                          <div className=\"flex-1 space-y-2\">\n                            <div className=\"flex items-center gap-2 flex-wrap\">\n                              <CardTitle className=\"text-lg\">{item.name}</CardTitle>\n                              {item.popular && (\n                                <Badge variant=\"secondary\" className=\"text-xs\">\n                                  Popular\n                                </Badge>\n                              )}\n                            </div>\n                            <CardDescription className=\"line-clamp-2\">\n                              {item.description}\n                            </CardDescription>\n                          </div>\n                          {item.image && (\n                            <div className=\"relative size-20 shrink-0 rounded-md overflow-hidden\">\n                              <Image\n                                src={item.image}\n                                alt={item.name}\n                                fill\n                                className=\"object-cover\"\n                              />\n                            </div>\n                          )}\n                        </div>\n                      </CardHeader>\n                      \n                      <CardContent>\n                        <div className=\"flex items-center justify-between\">\n                          <span className=\"text-lg font-semibold tabular-nums text-foreground\">{item.price}</span>\n                          <div className=\"flex gap-2\">\n                            {item.vegetarian && (\n                              <Leaf className=\"size-5 text-green-600 dark:text-green-500\" aria-label=\"Vegetarian\" />\n                            )}\n                            {item.spicy && (\n                              <Flame className=\"size-5 text-red-600 dark:text-red-500\" aria-label=\"Spicy\" />\n                            )}\n                          </div>\n                        </div>\n                      </CardContent>\n                    </Card>\n                  ))}\n                </div>\n              </div>\n            ))}\n          </div>\n        </div>\n      </Container>\n    </section>\n  );\n}\n"
    }
  ],
  "meta": {
    "label": "Restaurant Menu",
    "description": "Menu section with categories, items, prices, and dietary indicators",
    "tags": ["menu", "restaurant", "food", "dining", "categories"],
    "category": "menu",
    "tier": "free",
    "complexity": "moderate",
    "responsive": true,
    "darkMode": true,
    "animations": "None (follows UI_SKILLS - no animation unless requested)",
    "uiSkillsCompliant": true
  }
}
